"Name","Prerequisites","Effect"
"Foraging",,"Whenever you complete a rest in an area with a danger level of 2 or higher, gain the benefits of the Harvest downtime activity."
"Elaborate Preparation",,"You may add a modifer to consumable concoctions that you create."
"Curative Preparation",,"Your consumable concoctions may be spent during the Tend and Recover downtime activity. Each creature affected may consume one of them, and recover an additional stack of exhaustion. Only consumable concoctions made from defensive category spells may be spent in this way."
"Caffeinated",,"Whenever you complete a rest, you may choose not to remove a stack of exhaustion as normal. If you do, you may complete an additional downtime activity."
"Cunning Preparation",,"You may create traps using your concoctions when you use the Shape downtime activity by spending an appropriate consumable."
"Profitable Ventures",,"You gain access to the Transmute downtime activity. When you use it, make an Expertise (Anima/Fontcraft/Tinkering) skill check. You may sacrifice up to skill check result / 5 consumables. Gain 3 times that many essence crystals."
"Recycling",,"When you use the Devise downtime activity, you may sacrifice any number of additional consumables. Create one new consumable (of the same type selected) for each consumable sacrificed in this way."
"Shrewd",,"Add 1 to the interest score of every deal that you make."