"Name","Prerequisites","Effect"
"Slithering",,"You no longer move more slowly while prone, and no longer have disadvantage on melee attacks while prone."
"Camoflauge",,"If you have not taken a movement action since the start of your last turn, you have advantage on Stealth skill checks and your current tile is considered a hiding spot."
"Brawny",,"You have advantage on Shove attacks."
"Scrawny",,"Shove and Grapple attacks against you have disadvantage."
"Sensory Enhancement",,"You have advantage on skill checks made as part of the Spot and Scan actions."
"Horned",,"Whenever you move 2 or more tiles in a straight line, you may make a melee Shove attack against a creature that is in front of you without spending any AP."